{
    "ContentPermissionStore": {},
    "DataSourcesStorage": {},
    "InteractiveChartStorage": {},
    "KeyValueStore": {},
    "LayoutPropertiesKeyValueStore": {
        "__SystemAdministrator__Network_1__Network_LayoutManager": {
            "keyValueEntries": [
                {
                    "key": "PieChartNameAlias",
                    "value": "Product Type"
                },
                {
                    "key": "PieChartFontsizeTitle",
                    "value": "25"
                },
                {
                    "key": "ThresholdClassifier1ChNameAlias",
                    "value": "OEE Alarm"
                },
                {
                    "key": "ThresholdClassifier1ChShowMilliSeconds",
                    "value": "false"
                }
            ],
            "layoutID": "__SystemAdministrator__Network_1__Network_LayoutManager"
        }
    },
    "LayoutStore": {
        "__SystemAdministrator__Network_1__Network_LayoutManager__0": {
            "InteractiveControls": [],
            "LayoutHash": [],
            "LayoutID": "__SystemAdministrator__Network_1__Network_LayoutManager__0",
            "LayoutValue": []
        },
        "__SystemAdministrator__Network_1__Network_LayoutManager__2": {
            "InteractiveControls": [],
            "LayoutHash": [
                {
                    "CType": "TcHmi.Controls.Analytics.OEE",
                    "Cnt": 1
                },
                {
                    "CType": "TcHmi.Controls.Analytics.PieChart",
                    "Cnt": 1
                },
                {
                    "CType": "TcHmi.Controls.Analytics.TrafficLight",
                    "Cnt": 1
                },
                {
                    "CType": "TcHmi.Controls.Analytics.Process",
                    "Cnt": 1
                },
                {
                    "CType": "",
                    "Cnt": 1
                }
            ],
            "LayoutID": "__SystemAdministrator__Network_1__Network_LayoutManager__2",
            "LayoutValue": [
                {
                    "cE": 11,
                    "cS": 2,
                    "id": "PackMLOverallEquipmentEffectivenessOEE_GridElement",
                    "rE": 7,
                    "rS": 1,
                    "vis": true
                },
                {
                    "cE": 23,
                    "cS": 11,
                    "id": "PieChart_GridElement",
                    "rE": 9,
                    "rS": 1,
                    "vis": true
                },
                {
                    "cE": 6,
                    "cS": 2,
                    "id": "ThresholdClassifier1Ch_GridElement",
                    "rE": 16,
                    "rS": 7,
                    "vis": true
                },
                {
                    "cE": 23,
                    "cS": 6,
                    "id": "PreventiveMaintenanceLifetimeAnalysis_GridElement",
                    "rE": 16,
                    "rS": 9,
                    "vis": true
                },
                {
                    "cE": 23,
                    "cS": 11,
                    "id": "grid-buffer-cell-id",
                    "rE": 9,
                    "rS": 1,
                    "vis": false
                }
            ]
        }
    },
    "UserLayoutStore": {
        "__SystemAdministrator__Network_1__Network_LayoutManager__0": {
            "ContentID": "Network_1",
            "DisplayMode": "SMARTPHONE",
            "LayoutID": "__SystemAdministrator__Network_1__Network_LayoutManager__0",
            "UserID": "__SystemAdministrator",
            "UserLayoutID": "__SystemAdministrator__Network_1__Network_LayoutManager__0"
        },
        "__SystemAdministrator__Network_1__Network_LayoutManager__2": {
            "ContentID": "Network_1",
            "DisplayMode": "MONITOR",
            "LayoutID": "__SystemAdministrator__Network_1__Network_LayoutManager__2",
            "UserID": "__SystemAdministrator",
            "UserLayoutID": "__SystemAdministrator__Network_1__Network_LayoutManager__2"
        }
    }
}